{
  "schema_version": 1,
  "repository": "outbox-pattern",
  "commit_sha": "7888173e919edbd855970ed50d8139b49384792a",
  "branch": "main",
  "remote_url": "https://github.com/Brilhante29/outbox-pattern.git",
  "ci_conclusion": "success",
  "ci_run_url": "https://github.com/Brilhante29/outbox-pattern/actions/runs/37183190855",
  "workflow": "CI",
  "verified_at": "2026-10-04T06:46:25Z"
}
