{
  "schema_version": 1,
  "repository": "load-test-suite",
  "commit_sha": "97123b4a64f56a89438a400a897561281c6ef294",
  "branch": "main",
  "remote_url": "https://github.com/Brilhante29/load-test-suite.git",
  "ci_conclusion": "success",
  "ci_run_url": "https://github.com/Brilhante29/load-test-suite/actions/runs/37183083684",
  "workflow": "validate",
  "verified_at": "2026-10-04T06:46:25Z"
}
