{
  "schema_version": 1,
  "repository": "rag-knowledge-base",
  "commit_sha": "d88ccde0df517e1b17c3a0876fe23277084168fa",
  "branch": "main",
  "remote_url": "https://github.com/Brilhante29/rag-knowledge-base.git",
  "ci_conclusion": "success",
  "ci_run_url": "https://github.com/Brilhante29/rag-knowledge-base/actions/runs/37183245741",
  "workflow": "validate",
  "verified_at": "2026-10-04T06:46:25Z"
}
