{
  "schema_version": 1,
  "repository": "llm-agent-eval",
  "commit_sha": "63ba7831c5c069a54952b97f401fb185834d01b1",
  "branch": "main",
  "remote_url": "https://github.com/Brilhante29/llm-agent-eval.git",
  "ci_conclusion": "success",
  "ci_run_url": "https://github.com/Brilhante29/llm-agent-eval/actions/runs/37183262469",
  "workflow": "validate",
  "verified_at": "2026-10-04T06:46:25Z"
}
