{
  "schema_version": 1,
  "repository": "data-quality-checks",
  "commit_sha": "52df63c62d5799ec771f1d3a40a53e79633d49f7",
  "branch": "main",
  "remote_url": "https://github.com/Brilhante29/data-quality-checks.git",
  "ci_conclusion": "success",
  "ci_run_url": "https://github.com/Brilhante29/data-quality-checks/actions/runs/37183267513",
  "workflow": "validate",
  "verified_at": "2026-10-04T06:46:25Z"
}
