{
  "schema_version": 1,
  "repository": "portfolio-evidence-console",
  "commit_sha": "cfcfb610d4e070f8c5553874d0a747ef8655a3cd",
  "branch": "main",
  "remote_url": "https://github.com/Brilhante29/portfolio-evidence-console.git",
  "ci_conclusion": "success",
  "ci_run_url": "https://github.com/Brilhante29/portfolio-evidence-console/actions/runs/37183438277",
  "workflow": "ci",
  "verified_at": "2026-10-04T06:46:25Z"
}
