{
  "schema_version": 1,
  "repository": "mlops-end2end",
  "commit_sha": "86d7f23e622e50ba520c63476532193387d21e43",
  "branch": "main",
  "remote_url": "https://github.com/Brilhante29/mlops-end2end.git",
  "ci_conclusion": "success",
  "ci_run_url": "https://github.com/Brilhante29/mlops-end2end/actions/runs/37183075061",
  "workflow": "validate",
  "verified_at": "2026-10-04T06:46:25Z"
}
