{
  "schema_version": 1,
  "repository": "cost-aware-inference",
  "commit_sha": "207e03d1979464fc67928bb8c97c62d0ff447329",
  "branch": "main",
  "remote_url": "https://github.com/Brilhante29/cost-aware-inference.git",
  "ci_conclusion": "success",
  "ci_run_url": "https://github.com/Brilhante29/cost-aware-inference/actions/runs/37183266247",
  "workflow": "validate",
  "verified_at": "2026-10-04T06:46:25Z"
}
