{
  "schema_version": 1,
  "repository": "terraform-aws-baseline",
  "commit_sha": "dcee10563b011985fc362c0fa531b487b596a482",
  "branch": "main",
  "remote_url": "https://github.com/Brilhante29/terraform-aws-baseline.git",
  "ci_conclusion": "success",
  "ci_run_url": "https://github.com/Brilhante29/terraform-aws-baseline/actions/runs/37183243085",
  "workflow": "validation",
  "verified_at": "2026-10-04T06:46:25Z"
}
