{
  "schema_version": 1,
  "repository": "melanoma-classifier",
  "commit_sha": "f3c166a1617cf8c35c4fdcca36da01a1a6e2eda1",
  "branch": "main",
  "remote_url": "https://github.com/Brilhante29/melanoma-classifier.git",
  "ci_conclusion": "success",
  "ci_run_url": "https://github.com/Brilhante29/melanoma-classifier/actions/runs/37183381815",
  "workflow": "validate",
  "verified_at": "2026-10-04T06:46:25Z"
}
