{
  "schema_version": 1,
  "repository": "vision-serving-fastapi",
  "commit_sha": "f9b0e8eb0d6081fcb013094a814c669c095e07a1",
  "branch": "main",
  "remote_url": "https://github.com/Brilhante29/vision-serving-fastapi.git",
  "ci_conclusion": "success",
  "ci_run_url": "https://github.com/Brilhante29/vision-serving-fastapi/actions/runs/37183386272",
  "workflow": "validate",
  "verified_at": "2026-10-04T06:46:25Z"
}
