{
  "schema_version": 1,
  "repository": "event-sourcing-orders",
  "commit_sha": "92048e4d58ae2a03346c16d08ee94ef1a47cddb7",
  "branch": "main",
  "remote_url": "https://github.com/Brilhante29/event-sourcing-orders.git",
  "ci_conclusion": "success",
  "ci_run_url": "https://github.com/Brilhante29/event-sourcing-orders/actions/runs/37183195917",
  "workflow": "CI",
  "verified_at": "2026-10-04T06:46:25Z"
}
