{
  "schema_version": 1,
  "repository": "saga-orchestrator",
  "commit_sha": "59e6578c967db4c446dfea0162c7a2458c6a244b",
  "branch": "main",
  "remote_url": "https://github.com/Brilhante29/saga-orchestrator.git",
  "ci_conclusion": "success",
  "ci_run_url": "https://github.com/Brilhante29/saga-orchestrator/actions/runs/37183193827",
  "workflow": "CI",
  "verified_at": "2026-10-04T06:46:25Z"
}
