{
  "schema_version": 1,
  "repository": "mini-aws-emulator",
  "commit_sha": "8ceed14ce8a3c30f9e367d83e6f1d9cf2968ad2d",
  "branch": "main",
  "remote_url": "https://github.com/Brilhante29/mini-aws-emulator.git",
  "ci_conclusion": "success",
  "ci_run_url": "https://github.com/Brilhante29/mini-aws-emulator/actions/runs/37183255990",
  "workflow": "ci",
  "verified_at": "2026-10-04T06:46:25Z"
}
