{
  "schema_version": 1,
  "repository": "api-gateway-lite",
  "commit_sha": "f2726f1f1e0c85745bbaa3ce90baa8d629818916",
  "branch": "main",
  "remote_url": "https://github.com/Brilhante29/api-gateway-lite.git",
  "ci_conclusion": "success",
  "ci_run_url": "https://github.com/Brilhante29/api-gateway-lite/actions/runs/37183236206",
  "workflow": "CI",
  "verified_at": "2026-10-04T06:46:25Z"
}
