{
  "schema_version": 1,
  "repository": "spring-hexagonal-payments",
  "commit_sha": "23ffd0f826c76cf40731127dbc872ef9f6a8b4cd",
  "branch": "main",
  "remote_url": "https://github.com/Brilhante29/spring-hexagonal-payments.git",
  "ci_conclusion": "success",
  "ci_run_url": "https://github.com/Brilhante29/spring-hexagonal-payments/actions/runs/37183188951",
  "workflow": "ci",
  "verified_at": "2026-10-04T06:46:25Z"
}
