{
  "schema_version": 1,
  "repository": "ci-cd-templates",
  "commit_sha": "36e325dce43d993be300b6785f7cea9992cc90b1",
  "branch": "main",
  "remote_url": "https://github.com/Brilhante29/ci-cd-templates.git",
  "ci_conclusion": "success",
  "ci_run_url": "https://github.com/Brilhante29/ci-cd-templates/actions/runs/37183434637",
  "workflow": "ci",
  "verified_at": "2026-10-04T06:46:25Z"
}
