{
  "schema_version": 1,
  "repository": "stroke-signal-demo",
  "commit_sha": "81fd9ff27a5d2a2b73c10acfed1d4d08f75e0501",
  "branch": "main",
  "remote_url": "https://github.com/Brilhante29/stroke-signal-demo.git",
  "ci_conclusion": "success",
  "ci_run_url": "https://github.com/Brilhante29/stroke-signal-demo/actions/runs/37183379542",
  "workflow": "validate",
  "verified_at": "2026-10-04T06:46:25Z"
}
