{
  "schema_version": 1,
  "repository": "alpr-mercosul",
  "commit_sha": "3d58486e4bc9c0f3b8239c0fe2df7667abacc819",
  "branch": "main",
  "remote_url": "https://github.com/Brilhante29/alpr-mercosul.git",
  "ci_conclusion": "success",
  "ci_run_url": "https://github.com/Brilhante29/alpr-mercosul/actions/runs/37183389115",
  "workflow": "validate",
  "verified_at": "2026-10-04T06:46:25Z"
}
