{
  "schema_version": 1,
  "repository": "kafka-streams-demo",
  "commit_sha": "c01d215bb01e544261916f41991c122979cbd51d",
  "branch": "main",
  "remote_url": "https://github.com/Brilhante29/kafka-streams-demo.git",
  "ci_conclusion": "success",
  "ci_run_url": "https://github.com/Brilhante29/kafka-streams-demo/actions/runs/37183901244",
  "workflow": "ci",
  "verified_at": "2026-10-04T06:55:49Z"
}
