{
  "schema_version": 1,
  "repository": "prompt-ab-testing",
  "commit_sha": "659c0f41e8ab9930ea1fb3801b881bbac48ac60c",
  "branch": "main",
  "remote_url": "https://github.com/Brilhante29/prompt-ab-testing.git",
  "ci_conclusion": "success",
  "ci_run_url": "https://github.com/Brilhante29/prompt-ab-testing/actions/runs/37183264287",
  "workflow": "validate",
  "verified_at": "2026-10-04T06:46:25Z"
}
